{
  "$schema": "http://json-schema.org/draft-07/schema#",
  "title": "Project Roadmap Schema",
  "description": "Validates docs/roadmap.json — the machine-readable project delivery plan.",
  "type": "object",
  "required": ["phases", "current_phase", "current_outcome"],
  "additionalProperties": false,
  "properties": {
    "_comment": {
      "type": "string",
      "description": "Optional human-readable note about the file (JSON has no native comments)."
    },
    "current_phase": {
      "type": "string",
      "description": "ID of the currently active phase. Must match one of phases[*].id.",
      "minLength": 1
    },
    "current_outcome": {
      "type": "string",
      "description": "The highest-priority must-achieve outcome for the current phase (plain English).",
      "minLength": 1
    },
    "phases": {
      "type": "array",
      "description": "Ordered list of delivery phases.",
      "minItems": 1,
      "items": {
        "type": "object",
        "required": ["id", "title", "exit_criteria", "tickets_advancing_outcome"],
        "additionalProperties": false,
        "properties": {
          "id": {
            "type": "string",
            "description": "Stable machine-readable identifier for this phase (e.g. 'phase_1').",
            "pattern": "^[a-z][a-z0-9_]*$"
          },
          "title": {
            "type": "string",
            "description": "Human-readable phase title.",
            "minLength": 1
          },
          "description": {
            "type": "string",
            "description": "Optional longer description of what this phase covers."
          },
          "status": {
            "type": "string",
            "description": "Optional phase status.",
            "enum": ["active", "planned", "complete", "deferred"]
          },
          "exit_criteria": {
            "type": "array",
            "description": "List of measurable criteria that must be met to exit this phase.",
            "items": {
              "type": "string",
              "minLength": 1
            }
          },
          "tickets_advancing_outcome": {
            "type": "array",
            "description": "List of ticket identifiers (paths or slugs) that directly advance the current_outcome for this phase.",
            "items": {
              "type": "string"
            }
          }
        }
      }
    }
  }
}
